{
  "$schema": "https://json-schema.org/draft/2020-12/schema",
  "$id": "https://github.com/krishanraja/AEO-Engine/docs/packet.schema.json",
  "title": "AeoPacket v1",
  "description": "One week of answer-engine research for one subject. Written by AEO-Engine, read by Control Center's POST /api/aeo/ingest. Every string is plain English with no em dashes; no email address, no @handle, no call participant name anywhere.",
  "type": "object",
  "additionalProperties": false,
  "required": ["schema_version", "run_id", "command_id", "subject", "week_start", "generated_at", "engines", "themes_status", "themes", "calls", "queries", "strongest_signal", "recommendations", "watch_list", "competitor_gap", "playbook", "approach_hook", "stats"],
  "$defs": {
    "uuid": { "type": "string", "pattern": "^[0-9a-f]{8}-[0-9a-f]{4}-[0-9a-f]{4}-[0-9a-f]{4}-[0-9a-f]{12}$" },
    "ymd": { "type": "string", "pattern": "^\\d{4}-\\d{2}-\\d{2}$" },
    "engine": { "type": "string", "enum": ["perplexity", "chatgpt", "claude", "grok"] },
    "kind": { "type": "string", "enum": ["venture", "prospect", "aspiration"] },
    "evidence": {
      "type": "object",
      "additionalProperties": false,
      "required": ["call_ref", "date", "paraphrase"],
      "properties": {
        "call_ref": { "type": "string", "pattern": "^[0-9a-f]{8}$", "description": "An opaque short hash of the transcript id. Never the id itself." },
        "date": { "$ref": "#/$defs/ymd" },
        "paraphrase": { "type": "string", "minLength": 1, "maxLength": 200 }
      }
    },
    "probe": {
      "type": "object",
      "additionalProperties": false,
      "required": ["engine", "model", "question", "answer_snapshot", "we_cited", "citations", "cost_usd"],
      "properties": {
        "engine": { "$ref": "#/$defs/engine" },
        "model": { "type": "string", "maxLength": 80 },
        "question": { "type": "string", "minLength": 1, "maxLength": 400 },
        "answer_snapshot": { "type": "string", "maxLength": 1800 },
        "we_cited": { "type": "boolean" },
        "citations": { "type": "array", "maxItems": 8, "items": { "type": "string", "maxLength": 500 } },
        "cost_usd": { "type": "number", "minimum": 0 }
      }
    },
    "query": {
      "type": "object",
      "additionalProperties": false,
      "required": ["query_id", "query", "source", "demand_score", "demand_basis", "call_evidence", "gap", "trend", "status", "touchpoint_id", "probes"],
      "properties": {
        "query_id": { "$ref": "#/$defs/uuid" },
        "query": { "type": "string", "minLength": 3, "maxLength": 400 },
        "source": { "type": "string", "enum": ["transcript", "gap", "seed", "striking_distance", "watch_carry", "room_signal"] },
        "demand_score": { "type": "integer", "minimum": 0, "maximum": 100 },
        "demand_basis": {
          "type": "object",
          "additionalProperties": false,
          "required": ["llm_demand", "transcript_evidence", "rising_volume", "labels"],
          "properties": {
            "llm_demand": { "type": "integer", "minimum": 0, "maximum": 40 },
            "transcript_evidence": { "type": "integer", "minimum": 0, "maximum": 30 },
            "rising_volume": { "type": "integer", "minimum": 0, "maximum": 30 },
            "labels": { "type": "array", "items": { "type": "string", "maxLength": 120 } }
          }
        },
        "call_evidence": { "type": "array", "maxItems": 10, "items": { "$ref": "#/$defs/evidence" } },
        "gap": {
          "type": "object",
          "additionalProperties": false,
          "required": ["we_cited_engines", "competitor_domains"],
          "properties": {
            "we_cited_engines": { "type": "array", "items": { "$ref": "#/$defs/engine" } },
            "competitor_domains": { "type": "array", "maxItems": 12, "items": { "type": "string", "maxLength": 120 } }
          }
        },
        "trend": { "type": "string", "enum": ["new", "up", "flat", "down"] },
        "status": { "type": "string", "enum": ["watch", "recommend", "drop"] },
        "touchpoint_id": { "oneOf": [{ "$ref": "#/$defs/uuid" }, { "type": "null" }] },
        "probes": { "type": "array", "maxItems": 8, "items": { "$ref": "#/$defs/probe" } }
      }
    }
  },
  "properties": {
    "schema_version": { "const": 1 },
    "run_id": { "$ref": "#/$defs/uuid" },
    "command_id": { "oneOf": [{ "type": "integer", "minimum": 1 }, { "type": "null" }] },
    "subject": {
      "type": "object",
      "additionalProperties": false,
      "required": ["id", "kind", "slug", "product_slug"],
      "properties": {
        "id": { "$ref": "#/$defs/uuid" },
        "kind": { "$ref": "#/$defs/kind" },
        "slug": { "type": "string", "pattern": "^[a-z0-9][a-z0-9-]{0,79}$" },
        "product_slug": { "oneOf": [{ "type": "string", "enum": ["ctrl", "circle", "pulse", "full-time", "mindmake"] }, { "type": "null" }] }
      }
    },
    "week_start": { "$ref": "#/$defs/ymd", "description": "The Monday that owns the week, UTC. Same rule as api/_growth.ts mondayOf." },
    "generated_at": { "type": "string", "format": "date-time" },
    "engines": { "type": "array", "minItems": 1, "uniqueItems": true, "items": { "$ref": "#/$defs/engine" } },
    "themes_status": { "type": "string", "enum": ["ok", "no_calls", "no_attributed_calls", "fireflies_unavailable", "not_applicable"] },
    "themes": {
      "type": "array",
      "maxItems": 10,
      "items": {
        "type": "object",
        "additionalProperties": false,
        "required": ["theme", "calls", "evidence"],
        "properties": {
          "theme": { "type": "string", "minLength": 1, "maxLength": 200 },
          "calls": { "type": "integer", "minimum": 1 },
          "evidence": { "type": "array", "maxItems": 6, "items": { "$ref": "#/$defs/evidence" } }
        }
      }
    },
    "calls": {
      "type": "object",
      "additionalProperties": false,
      "required": ["considered", "attributed"],
      "properties": {
        "considered": { "type": "integer", "minimum": 0 },
        "attributed": { "type": "integer", "minimum": 0 }
      }
    },
    "queries": { "type": "array", "maxItems": 60, "items": { "$ref": "#/$defs/query" } },
    "strongest_signal": { "oneOf": [{ "type": "string", "minLength": 1, "maxLength": 240 }, { "type": "null" }] },
    "recommendations": {
      "type": "array",
      "maxItems": 5,
      "items": {
        "type": "object",
        "additionalProperties": false,
        "required": ["n", "title", "target_query", "query_id", "angle", "evidence", "engines", "demand"],
        "properties": {
          "n": { "type": "integer", "minimum": 1, "maximum": 5 },
          "title": { "type": "string", "minLength": 1, "maxLength": 200 },
          "target_query": { "type": "string", "minLength": 1, "maxLength": 400 },
          "query_id": { "$ref": "#/$defs/uuid" },
          "angle": { "type": "string", "minLength": 1, "maxLength": 600 },
          "evidence": { "type": "array", "maxItems": 6, "items": { "type": "string", "maxLength": 300 } },
          "engines": { "type": "array", "items": { "$ref": "#/$defs/engine" } },
          "demand": { "type": "integer", "minimum": 0, "maximum": 100 },
          "why_you_can_win": {
            "oneOf": [{ "type": "string", "minLength": 1, "maxLength": 300 }, { "type": "null" }],
            "description": "The specific reason this subject can win THIS answer when the sites cited today structurally cannot, drawn from the business canon or from measured evidence. Never a generality. Null when the digest could not justify one, which is a bug in the digest and not a licence to recommend anyway. Additive in v1: absent on a packet written before the winnability gate."
          }
        }
      }
    },
    "not_worth_chasing": {
      "type": "array",
      "maxItems": 6,
      "description": "Questions that were probed and scored and that the subject should NOT try to win. Worth more than a bad recommendation, because it stops a week being spent on an answer a social network, a video platform, a national business title or a big consultancy already owns. Every query_id is one of this packet's queries and is not also a recommendation. Additive in v1: absent on a packet written before the winnability gate.",
      "items": {
        "type": "object",
        "additionalProperties": false,
        "required": ["query_id", "query", "owned_by", "why_not"],
        "properties": {
          "query_id": { "$ref": "#/$defs/uuid" },
          "query": { "type": "string", "minLength": 1, "maxLength": 400 },
          "owned_by": { "type": "array", "maxItems": 8, "items": { "type": "string", "minLength": 1, "maxLength": 120 }, "description": "The hosts that own the answer now, most cited first." },
          "why_not": { "type": "string", "minLength": 1, "maxLength": 300, "description": "One plain sentence on why this subject will not displace them. No hedging." }
        }
      }
    },
    "watch_list": {
      "type": "array",
      "maxItems": 15,
      "items": {
        "type": "object",
        "additionalProperties": false,
        "required": ["query_id", "query", "why"],
        "properties": {
          "query_id": { "$ref": "#/$defs/uuid" },
          "query": { "type": "string", "maxLength": 400 },
          "why": { "type": "string", "maxLength": 240 }
        }
      }
    },
    "competitor_gap": {
      "type": "object",
      "additionalProperties": false,
      "required": ["domain", "times_cited", "questions"],
      "properties": {
        "domain": { "oneOf": [{ "type": "string", "maxLength": 120 }, { "type": "null" }] },
        "times_cited": { "type": "integer", "minimum": 0 },
        "questions": { "type": "array", "maxItems": 10, "items": { "type": "string", "maxLength": 400 } }
      }
    },
    "playbook": {
      "description": "Aspirations only: which of the subject's own pages the engines cite, and why. Null for the other kinds.",
      "oneOf": [
        { "type": "null" },
        {
          "type": "array",
          "maxItems": 12,
          "items": {
            "type": "object",
            "additionalProperties": false,
            "required": ["url", "host", "path_pattern", "times_cited", "why"],
            "properties": {
              "url": { "type": "string", "maxLength": 500 },
              "host": { "type": "string", "maxLength": 120 },
              "path_pattern": { "type": "string", "maxLength": 120 },
              "times_cited": { "type": "integer", "minimum": 1 },
              "why": { "type": "string", "maxLength": 300 }
            }
          }
        }
      ]
    },
    "approach_hook": {
      "description": "Prospects only: one sentence Krish could open with, grounded in a cited answer. Null for the other kinds.",
      "oneOf": [{ "type": "string", "minLength": 1, "maxLength": 300 }, { "type": "null" }]
    },
    "stats": {
      "type": "object",
      "additionalProperties": false,
      "required": ["queries", "probes", "probes_failed", "probes_skipped_cap", "cost_usd", "engines", "transcripts", "digest_writer"],
      "properties": {
        "queries": { "type": "integer", "minimum": 0 },
        "probes": { "type": "integer", "minimum": 0 },
        "probes_failed": { "type": "integer", "minimum": 0 },
        "probes_skipped_cap": { "type": "integer", "minimum": 0 },
        "cost_usd": { "type": "number", "minimum": 0 },
        "engines": { "type": "integer", "minimum": 0 },
        "transcripts": { "type": "integer", "minimum": 0 },
        "digest_writer": { "type": "string", "enum": ["claude", "fallback"] }
      }
    }
  }
}
