{
  "schema_version": 1,
  "run_id": "f0bdd1aa-edaa-413b-aeb3-c4f2d88f82d3",
  "command_id": null,
  "subject": {
    "id": "1b7f3c2e-4a5d-4c8b-9e1f-2a3b4c5d6e7f",
    "kind": "venture",
    "slug": "ctrl",
    "product_slug": "ctrl"
  },
  "week_start": "2026-09-07",
  "generated_at": "2026-09-08T07:47:06.686Z",
  "engines": [
    "perplexity",
    "chatgpt",
    "claude"
  ],
  "themes_status": "ok",
  "themes": [
    {
      "theme": "How do I get an AI assistant to write in my own voice",
      "calls": 1,
      "evidence": [
        {
          "call_ref": "5941637d",
          "date": "2026-09-03",
          "paraphrase": "Everything the assistant produces reads like a press release and the team can tell it was not written by them."
        },
        {
          "call_ref": "5941637d",
          "date": "2026-09-03",
          "paraphrase": "They want the same voice in a short email, a post and a board deck without rewriting every draft."
        }
      ]
    },
    {
      "theme": "AI output sounds generic and needs heavy editing",
      "calls": 1,
      "evidence": [
        {
          "call_ref": "5941637d",
          "date": "2026-09-03",
          "paraphrase": "Pasting old posts into a custom GPT helped for a few replies, then the output drifted back to generic."
        }
      ]
    },
    {
      "theme": "Should I build my own AI skill or buy one",
      "calls": 1,
      "evidence": [
        {
          "call_ref": "5941637d",
          "date": "2026-09-03",
          "paraphrase": "They keep hitting the question of whether to build a personal skill themselves or buy something."
        }
      ]
    },
    {
      "theme": "How much of my own writing does the model need to learn my style",
      "calls": 1,
      "evidence": [
        {
          "call_ref": "5941637d",
          "date": "2026-09-03",
          "paraphrase": "They have years of emails, decks and a newsletter and do not know how much of it the model needs."
        }
      ]
    },
    {
      "theme": "Keeping a consistent voice across email, posts and decks",
      "calls": 1,
      "evidence": [
        {
          "call_ref": "5941637d",
          "date": "2026-09-03",
          "paraphrase": "Consistent means one voice across a two-line email, a LinkedIn post and a board deck."
        }
      ]
    }
  ],
  "calls": {
    "considered": 2,
    "attributed": 1
  },
  "queries": [
    {
      "query_id": "b1000000-0000-4000-8000-000000000001",
      "query": "How do I get an AI assistant to write like me?",
      "source": "transcript",
      "demand_score": 65,
      "demand_basis": {
        "llm_demand": 30,
        "transcript_evidence": 20,
        "rising_volume": 15,
        "labels": [
          "no prompt-volume corpus; proxies only"
        ]
      },
      "call_evidence": [
        {
          "call_ref": "5941637d",
          "date": "2026-09-03",
          "paraphrase": "Everything the assistant produces reads like a press release and the team can tell it was not written by them."
        },
        {
          "call_ref": "5941637d",
          "date": "2026-09-03",
          "paraphrase": "They want the same voice in a short email, a post and a board deck without rewriting every draft."
        }
      ],
      "gap": {
        "we_cited_engines": [
          "chatgpt"
        ],
        "competitor_domains": [
          "example-writer-tools.com",
          "docs.example-assistant.com",
          "help.example-assistant.com"
        ]
      },
      "trend": "up",
      "status": "recommend",
      "touchpoint_id": "a1000000-0000-4000-8000-000000000001",
      "probes": [
        {
          "engine": "perplexity",
          "model": "sonar",
          "question": "How do I get an AI assistant to write like me?",
          "answer_snapshot": "Summary: the question of get an AI assistant to write like me comes down to a few concrete steps. First, decide what good looks like and write it down as examples rather than adjectives. Second, give the tool those examples in a form it can check itself against, then measure the drift over a week of real use. Third, keep a short list of the cases where it still fails and fix those one at a time rather than rewriting the whole setup. Most teams that do this see the output settle within a couple of weeks; the ones that skip the examples step keep editing every draft by hand.",
          "we_cited": false,
          "citations": [
            "https://help.example-assistant.com/style",
            "https://www.example-writer-tools.com/blog/2026/train-your-voice"
          ],
          "cost_usd": 0.01
        },
        {
          "engine": "chatgpt",
          "model": "gpt-5",
          "question": "How do I get an AI assistant to write like me?",
          "answer_snapshot": "In short: the question of get an AI assistant to write like me comes down to two or three decisions. First, decide what good looks like and write it down as examples rather than adjectives. Second, give the tool those examples in a form it can check itself against, then measure the drift over a week of real use. Third, keep a short list of the cases where it still fails and fix those one at a time rather than rewriting the whole setup. Most teams that do this see the output settle within a couple of weeks; the ones that skip the examples step keep editing every draft by hand.",
          "we_cited": true,
          "citations": [
            "https://mindmake.co/ctrl",
            "https://www.example-writer-tools.com/guide/voice"
          ],
          "cost_usd": 0.03
        },
        {
          "engine": "claude",
          "model": "claude-sonnet-5",
          "question": "How do I get an AI assistant to write like me?",
          "answer_snapshot": "Here is the practical answer: the question of get an AI assistant to write like me comes down to a few concrete steps. First, decide what good looks like and write it down as examples rather than adjectives. Second, give the tool those examples in a form it can check itself against, then measure the drift over a week of real use. Third, keep a short list of the cases where it still fails and fix those one at a time rather than rewriting the whole setup. Most teams that do this see the output settle within a couple of weeks; the ones that skip the examples step keep editing every draft by hand.",
          "we_cited": false,
          "citations": [
            "https://www.example-writer-tools.com/blog/2026/train-your-voice",
            "https://docs.example-assistant.com/custom-instructions"
          ],
          "cost_usd": 0.04
        }
      ]
    },
    {
      "query_id": "b352032b-3bee-4b1e-8b22-d838679921b0",
      "query": "What is a personal AI writing style?",
      "source": "striking_distance",
      "demand_score": 60,
      "demand_basis": {
        "llm_demand": 30,
        "transcript_evidence": 0,
        "rising_volume": 30,
        "labels": [
          "no prompt-volume corpus; proxies only",
          "Google volume via DataForSEO"
        ]
      },
      "call_evidence": [],
      "gap": {
        "we_cited_engines": [],
        "competitor_domains": [
          "example-writer-tools.com",
          "docs.example-assistant.com",
          "example-prompting.com",
          "forum.example-dev.org",
          "help.example-assistant.com"
        ]
      },
      "trend": "new",
      "status": "recommend",
      "touchpoint_id": null,
      "probes": [
        {
          "engine": "perplexity",
          "model": "sonar",
          "question": "What is a personal AI writing style?",
          "answer_snapshot": "Summary: the question of a personal AI writing style comes down to a few concrete steps. First, decide what good looks like and write it down as examples rather than adjectives. Second, give the tool those examples in a form it can check itself against, then measure the drift over a week of real use. Third, keep a short list of the cases where it still fails and fix those one at a time rather than rewriting the whole setup. Most teams that do this see the output settle within a couple of weeks; the ones that skip the examples step keep editing every draft by hand.",
          "we_cited": false,
          "citations": [
            "https://www.example-writer-tools.com/blog/2026/train-your-voice",
            "https://help.example-assistant.com/style"
          ],
          "cost_usd": 0.01
        },
        {
          "engine": "chatgpt",
          "model": "gpt-5",
          "question": "What is a personal AI writing style?",
          "answer_snapshot": "In short: the question of a personal AI writing style comes down to two or three decisions. First, decide what good looks like and write it down as examples rather than adjectives. Second, give the tool those examples in a form it can check itself against, then measure the drift over a week of real use. Third, keep a short list of the cases where it still fails and fix those one at a time rather than rewriting the whole setup. Most teams that do this see the output settle within a couple of weeks; the ones that skip the examples step keep editing every draft by hand.",
          "we_cited": false,
          "citations": [
            "https://www.example-prompting.com/voice-guide",
            "https://forum.example-dev.org/t/skills/123"
          ],
          "cost_usd": 0.03
        },
        {
          "engine": "claude",
          "model": "claude-sonnet-5",
          "question": "What is a personal AI writing style?",